{
  "request_id": "NR-CF-0011",
  "request_version": 1,
  "request_type": "confirmation",
  "outcome": "answered",
  "sources": [
    {
      "source_id": "SRC-CONF-0011",
      "held": "held",
      "version": "1",
      "sha256": "93e1c16c488abe5f2b1c0e7c0275a9d93d85d3c3442c5b52469479f141d9066b",
      "location": "[ORG]AIOC-SL output socket @ SLM-0600aba3e5d8a927341ce6fe09ff9257309c0448fb6397fedf689cd05a6c284f",
      "snapshot_id": "SLM-0600aba3e5d8a927341ce6fe09ff9257309c0448fb6397fedf689cd05a6c284f",
      "origin_kind": "confirmation",
      "status": "in force",
      "confidentiality": "internal",
      "statement_labels": [
        {
          "anchor": "p1",
          "sl_label": "stated"
        }
      ]
    }
  ],
  "answered_by": {
    "contributor_ref": "CONTRIB-0007"
  },
  "confirmation": {
    "value": "confirm",
    "known_before": "no"
  },
  "answered_at": "2026-10-22T09:00:00Z"
}
